{
  "$schema": "../packages/sdk/schema/index.schema.json",
  "schema": 1,
  "name": "LinPlayer 官方插件",
  "updated": "2026-09-21T03:19:34.780Z",
  "plugins": [
    {
      "id": "linplayer/devtools",
      "name": "开发者工具",
      "description": "官方开发者工具:日志、网络请求、UI 树、性能与存储四块调试面板,外加渲染器的组件示例页与一千项大列表。",
      "author": "linplayer",
      "repository": "https://github.com/zzzwannasleep/LinPlayer",
      "official": true,
      "addedAt": "2026-09-21T02:27:35.917Z",
      "contributes": [
        "pages",
        "sidebar"
      ],
      "categories": [
        "tool"
      ],
      "versions": [
        {
          "version": "0.1.0",
          "url": "https://github.com/zzzwannasleep/LinplayerPluginsRepository/releases/download/plugins/devtools-0.1.0.lpplugin",
          "size": 17034,
          "minAppVersion": "2.0.0",
          "released": "2026-09-21T02:27:35.918Z"
        }
      ]
    },
    {
      "id": "linplayer/live",
      "name": "直播",
      "description": "看直播:贴一条 m3u / txt 地址就能用,装了 TVBox 插件的话它配置里的直播源也会自动出现。同名频道合并成「源 1/2/3」,播不动自动换下一条并记住能用的那条;XMLTV 节目单、回看/时移、收藏与自定义频道号;TV 上按 TVBox 的习惯操作(上下换台、数字键输号、确认呼出列表)。",
      "author": "linplayer",
      "repository": "https://github.com/zzzwannasleep/LinPlayer",
      "official": true,
      "addedAt": "2026-09-21T02:27:35.918Z",
      "contributes": [
        "commands",
        "pages",
        "playerOverlays",
        "settings",
        "sidebar"
      ],
      "categories": [
        "live",
        "player"
      ],
      "versions": [
        {
          "version": "0.1.0",
          "url": "https://github.com/zzzwannasleep/LinplayerPluginsRepository/releases/download/plugins/live-0.1.0.lpplugin",
          "size": 38275,
          "minAppVersion": "2.0.0",
          "released": "2026-09-21T02:27:35.918Z"
        }
      ],
      "lan": true
    },
    {
      "id": "linplayer/rule-editor",
      "name": "drpy 规则编辑器",
      "description": "写 drpy 规则的人用:贴进规则,点「测试」在隔离的子运行时里跑一遍 首页 / 分类 / 详情 / 播放,结果或报错栈当场看;满意了「保存为数据源」。drpy 引擎与依赖库打包在本插件里,不依赖 TVBox 插件。",
      "author": "linplayer",
      "repository": "https://github.com/zzzwannasleep/LinPlayer",
      "official": true,
      "addedAt": "2026-09-21T02:27:35.918Z",
      "contributes": [
        "pages",
        "sidebar"
      ],
      "categories": [
        "tool"
      ],
      "versions": [
        {
          "version": "0.1.0",
          "url": "https://github.com/zzzwannasleep/LinplayerPluginsRepository/releases/download/plugins/rule-editor-0.1.0.lpplugin",
          "size": 250640,
          "minAppVersion": "2.0.0",
          "released": "2026-09-21T02:27:35.918Z"
        }
      ]
    },
    {
      "id": "linplayer/subtitle-translate",
      "name": "字幕翻译",
      "description": "把当前字幕翻成你看得懂的语言:支持 OpenAI 兼容接口、Anthropic、百度翻译(用你自己的 key)。没有字幕时可以先用 Whisper 转写。结果按「源字幕 + 引擎 + 语言 + 排版」缓存,同一集看第二遍不再花额度。",
      "author": "linplayer",
      "repository": "https://github.com/zzzwannasleep/LinPlayer",
      "official": true,
      "addedAt": "2026-09-21T02:27:35.919Z",
      "contributes": [
        "commands",
        "playerOverlays",
        "playerPanels",
        "settings"
      ],
      "categories": [
        "danmakuSubtitle",
        "player"
      ],
      "versions": [
        {
          "version": "0.1.0",
          "url": "https://github.com/zzzwannasleep/LinplayerPluginsRepository/releases/download/plugins/subtitle-translate-0.1.0.lpplugin",
          "size": 21044,
          "minAppVersion": "2.0.0",
          "released": "2026-09-21T02:27:35.919Z"
        }
      ],
      "requires": {
        "components": [
          "whisper",
          "ffmpeg"
        ]
      }
    },
    {
      "id": "linplayer/sync",
      "name": "Trakt / Bangumi 同步",
      "description": "把看过的进度同步到 Trakt 与 Bangumi:播放时 scrobble、看完标记、详情页显示同步状态、收藏与集数进度管理。账号在宿主里连,插件只借用不接触 token。",
      "author": "linplayer",
      "repository": "https://github.com/zzzwannasleep/LinPlayer",
      "official": true,
      "addedAt": "2026-09-21T02:27:35.919Z",
      "contributes": [
        "anchors",
        "pages",
        "settings",
        "settingsSections"
      ],
      "categories": [
        "tool"
      ],
      "versions": [
        {
          "version": "0.1.0",
          "url": "https://github.com/zzzwannasleep/LinplayerPluginsRepository/releases/download/plugins/sync-0.1.0.lpplugin",
          "size": 13148,
          "minAppVersion": "2.0.0",
          "released": "2026-09-21T02:27:35.919Z"
        }
      ]
    },
    {
      "id": "linplayer/theme-midnight",
      "name": "午夜蓝(桌面)",
      "description": "官方示范主题:更深的蓝底、更亮的强调色。示范一个主题包能改什么 —— 设计 token 与组件状态样式,结构和行为不变。",
      "author": "linplayer",
      "repository": "https://github.com/zzzwannasleep/LinPlayer",
      "official": true,
      "addedAt": "2026-09-21T02:27:35.919Z",
      "contributes": [
        "theme"
      ],
      "categories": [
        "theme"
      ],
      "versions": [
        {
          "version": "0.1.0",
          "url": "https://github.com/zzzwannasleep/LinplayerPluginsRepository/releases/download/plugins/theme-midnight-0.1.0.lpplugin",
          "size": 1827,
          "minAppVersion": "2.0.0",
          "released": "2026-09-21T02:27:35.919Z",
          "platforms": [
            "windows",
            "linux"
          ]
        }
      ]
    },
    {
      "id": "linplayer/theme-midnight-phone",
      "name": "午夜蓝(手机)",
      "description": "官方示范主题:更深的蓝底、更亮的强调色。示范一个主题包能改什么 —— 设计 token 与组件状态样式,结构和行为不变。",
      "author": "linplayer",
      "repository": "https://github.com/zzzwannasleep/LinPlayer",
      "official": true,
      "addedAt": "2026-09-21T02:27:35.920Z",
      "contributes": [
        "theme"
      ],
      "categories": [
        "theme"
      ],
      "versions": [
        {
          "version": "0.1.0",
          "url": "https://github.com/zzzwannasleep/LinplayerPluginsRepository/releases/download/plugins/theme-midnight-phone-0.1.0.lpplugin",
          "size": 1508,
          "minAppVersion": "2.0.0",
          "released": "2026-09-21T02:27:35.920Z",
          "platforms": [
            "android"
          ]
        }
      ]
    },
    {
      "id": "linplayer/theme-midnight-tv",
      "name": "午夜蓝(TV)",
      "description": "官方示范主题:更深的蓝底、更亮的强调色。示范一个主题包能改什么 —— 设计 token 与组件状态样式,结构和行为不变。",
      "author": "linplayer",
      "repository": "https://github.com/zzzwannasleep/LinPlayer",
      "official": true,
      "addedAt": "2026-09-21T02:27:35.920Z",
      "contributes": [
        "theme"
      ],
      "categories": [
        "theme"
      ],
      "versions": [
        {
          "version": "0.1.0",
          "url": "https://github.com/zzzwannasleep/LinplayerPluginsRepository/releases/download/plugins/theme-midnight-tv-0.1.0.lpplugin",
          "size": 1530,
          "minAppVersion": "2.0.0",
          "released": "2026-09-21T02:27:35.920Z",
          "platforms": [
            "android_tv"
          ]
        }
      ]
    },
    {
      "id": "linplayer/tvbox",
      "name": "TVBox 兼容",
      "description": "导入 TVBox 配置订阅或 drpy 规则,把里面的站点变成可以浏览、搜索、播放的数据源。插件本身不带任何源,内容由用户自行订阅。",
      "author": "linplayer",
      "repository": "https://github.com/zzzwannasleep/LinPlayer",
      "official": true,
      "addedAt": "2026-09-21T02:27:35.920Z",
      "contributes": [
        "commands",
        "dataSource",
        "m3u8Filters",
        "menus",
        "registry",
        "settings"
      ],
      "categories": [
        "dataSource"
      ],
      "versions": [
        {
          "version": "0.2.0",
          "url": "https://github.com/zzzwannasleep/LinplayerPluginsRepository/releases/download/plugins/tvbox-0.2.0.lpplugin",
          "size": 285430,
          "minAppVersion": "2.0.0",
          "released": "2026-09-21T03:19:34.779Z"
        }
      ],
      "lan": true,
      "requires": {
        "components": [
          "jar-runtime",
          "python"
        ]
      }
    }
  ]
}
